{
  "schema_version": "3.0",
  "template_version": "3.0-test-manifest",
  "sheet_id": "WTS-SS-SECONDARY-LARGE-001",
  "class": "TEST SS2",
  "subject_group": "Mathematics",
  "layout_id": "secondary-mathematics-v3",
  "layout_family": "SECONDARY_SINGLE_SUBJECT",
  "session": "2026/2027",
  "term": "FIRST",
  "expected_page_ids": ["WTS-SS-SECONDARY-LARGE-001-P1", "WTS-SS-SECONDARY-LARGE-001-P2", "WTS-SS-SECONDARY-LARGE-001-P3"],
  "pages": [
    {"page_id": "WTS-SS-SECONDARY-LARGE-001-P1", "page_number": 1, "row_start": 1, "row_end": 15, "layout_id": "secondary-mathematics-v3", "rows": []},
    {"page_id": "WTS-SS-SECONDARY-LARGE-001-P2", "page_number": 2, "row_start": 16, "row_end": 30, "layout_id": "secondary-mathematics-v3", "rows": []},
    {"page_id": "WTS-SS-SECONDARY-LARGE-001-P3", "page_number": 3, "row_start": 31, "row_end": 36, "layout_id": "secondary-mathematics-v3", "rows": []}
  ]
}
